{
  "schema_version": "1.0",
  "plugin": "VC-EQ",
  "preset_name": "air-presence",
  "author": "VC-Team",
  "description": "Air and presence boost for vocal clarity and shimmer",
  "tags": ["air", "presence", "clarity", "vocal"],
  "parameters": {
    "band0-freq": 80,
    "band0-type": 4,
    "band0-gain": 0,
    "band0-q": 0.7,
    "band0-on": 1,
    "band1-freq": 250,
    "band1-type": 2,
    "band1-gain": 0,
    "band1-q": 1.0,
    "band1-on": 0,
    "band2-freq": 2500,
    "band2-type": 2,
    "band2-gain": 2,
    "band2-q": 1.0,
    "band2-on": 1,
    "band3-freq": 6000,
    "band3-type": 2,
    "band3-gain": 3,
    "band3-q": 1.2,
    "band3-on": 1,
    "band4-freq": 14000,
    "band4-type": 1,
    "band4-gain": 3.5,
    "band4-q": 0.7,
    "band4-on": 1
  }
}
