{
  "schema_version": "1.0",
  "plugin": "VC-EQ",
  "preset_name": "bass-boost",
  "author": "VC-Team",
  "description": "Bass enhancement with sub warmth and low-mid fullness",
  "tags": ["bass", "warmth", "low-end"],
  "parameters": {
    "band0-freq": 60,
    "band0-type": 0,
    "band0-gain": 4,
    "band0-q": 0.7,
    "band0-on": 1,
    "band1-freq": 120,
    "band1-type": 2,
    "band1-gain": 3,
    "band1-q": 0.8,
    "band1-on": 1,
    "band2-freq": 300,
    "band2-type": 2,
    "band2-gain": 1.5,
    "band2-q": 1.0,
    "band2-on": 1,
    "band3-freq": 1000,
    "band3-type": 2,
    "band3-gain": 0,
    "band3-q": 1.0,
    "band3-on": 0,
    "band4-freq": 8000,
    "band4-type": 1,
    "band4-gain": 0,
    "band4-q": 0.7,
    "band4-on": 0
  }
}
